[
  {"id":"emberlyn","legacyId":0,"artId":0,"name":"Emberlyn","types":["Flame"],"coverageType":"Gale"},
  {"id":"cindrake","legacyId":1,"artId":1,"name":"Cindrake","types":["Flame","Stone"],"coverageType":"Stone"},
  {"id":"volcaram","legacyId":2,"artId":2,"name":"Volcaram","types":["Flame","Steel"],"coverageType":"Steel"},
  {"id":"tideray","legacyId":3,"artId":3,"name":"Tideray","types":["Tide"],"coverageType":"Gale"},
  {"id":"coralisk","legacyId":4,"artId":4,"name":"Coralisk","types":["Tide","Venom"],"coverageType":"Venom"},
  {"id":"shellure","legacyId":5,"artId":5,"name":"Shellure","types":["Tide","Steel"],"coverageType":"Steel"},
  {"id":"mossprout","legacyId":6,"artId":6,"name":"Mossprout","types":["Bloom"],"coverageType":"Gale"},
  {"id":"thornox","legacyId":7,"artId":7,"name":"Thornox","types":["Bloom","Stone"],"coverageType":"Stone"},
  {"id":"florawisp","legacyId":8,"artId":8,"name":"Florawisp","types":["Bloom","Light"],"coverageType":"Light"},
  {"id":"voltkit","legacyId":9,"artId":9,"name":"Voltkit","types":["Volt"],"coverageType":"Shadow"},
  {"id":"stormaw","legacyId":10,"artId":10,"name":"Stormaw","types":["Volt","Gale"],"coverageType":"Gale"},
  {"id":"ampillo","legacyId":11,"artId":11,"name":"Ampillo","types":["Volt","Steel"],"coverageType":"Steel"},
  {"id":"frostowl","legacyId":12,"artId":12,"name":"Frostowl","types":["Frost"],"coverageType":"Gale"},
  {"id":"glacirn","legacyId":13,"artId":13,"name":"Glacirn","types":["Frost","Light"],"coverageType":"Light"},
  {"id":"snowmelt","legacyId":14,"artId":14,"name":"Snowmelt","types":["Frost","Tide"],"coverageType":"Tide"},
  {"id":"pebblit","legacyId":15,"artId":15,"name":"Pebblit","types":["Stone"],"coverageType":"Tide"},
  {"id":"obsidon","legacyId":16,"artId":16,"name":"Obsidon","types":["Stone","Steel"],"coverageType":"Steel"},
  {"id":"dunewyrm","legacyId":17,"artId":17,"name":"Dunewyrm","types":["Stone","Shadow"],"coverageType":"Shadow"},
  {"id":"zephyroo","legacyId":18,"artId":18,"name":"Zephyroo","types":["Gale"],"coverageType":"Stone"},
  {"id":"galesong","legacyId":19,"artId":19,"name":"Galesong","types":["Gale","Light"],"coverageType":"Light"},
  {"id":"cyclopup","legacyId":20,"artId":20,"name":"Cyclopup","types":["Gale","Volt"],"coverageType":"Volt"},
  {"id":"gloomoth","legacyId":21,"artId":21,"name":"Gloomoth","types":["Shadow"],"coverageType":"Venom"},
  {"id":"noctalon","legacyId":22,"artId":22,"name":"Noctalon","types":["Shadow","Gale"],"coverageType":"Gale"},
  {"id":"umbrawolf","legacyId":23,"artId":23,"name":"Umbrawolf","types":["Shadow","Astral"],"coverageType":"Astral"},
  {"id":"solmane","legacyId":24,"artId":24,"name":"Solmane","types":["Light"],"coverageType":"Flame"},
  {"id":"aurorix","legacyId":25,"artId":25,"name":"Aurorix","types":["Light","Astral"],"coverageType":"Astral"},
  {"id":"lumifin","legacyId":26,"artId":26,"name":"Lumifin","types":["Light","Tide"],"coverageType":"Tide"},
  {"id":"venomble","legacyId":27,"artId":27,"name":"Venomble","types":["Venom"],"coverageType":"Tide"},
  {"id":"toxipede","legacyId":28,"artId":28,"name":"Toxipede","types":["Venom","Stone"],"coverageType":"Stone"},
  {"id":"mirecap","legacyId":29,"artId":29,"name":"Mirecap","types":["Venom","Bloom"],"coverageType":"Bloom"},
  {"id":"ironcub","legacyId":30,"artId":30,"name":"Ironcub","types":["Steel"],"coverageType":"Stone"},
  {"id":"gearaptor","legacyId":31,"artId":31,"name":"Gearaptor","types":["Steel","Gale"],"coverageType":"Gale"},
  {"id":"chromantis","legacyId":32,"artId":32,"name":"Chromantis","types":["Steel","Bloom"],"coverageType":"Bloom"},
  {"id":"astralyn","legacyId":33,"artId":33,"name":"Astralyn","types":["Astral"],"coverageType":"Shadow"},
  {"id":"runelisk","legacyId":34,"artId":34,"name":"Runelisk","types":["Astral","Stone"],"coverageType":"Stone"},
  {"id":"orbitail","legacyId":35,"artId":35,"name":"Orbitail","types":["Astral","Tide"],"coverageType":"Tide"}
]

